Post_ID,Post_type,Date,Impressions,From_Home,From_Hashtags,From_Explore,From_Other,Saves,Comments,Shares,Likes,Profile_Visits,Follows,Conversion_Rate,Caption,Hashtags
PID0001,Reel,2021-12-10,3920,2586,1028,619,56,98,9,5,162,35,2,5.71429,"Here are some of the most important data visualizations that every Financial Data Analyst/Scientist should know.",#finance #money #business #investing #investment #trading #stockmarket #data #datascience #dataanalysis #dataanalytics #datascientist #machinelearning #python #pythonprogramming #pythonprojects #pythoncode #artificialintelligence #ai #dataanalyst #amankharwal #thecleverprogrammer
PID0002,Image,2021-12-11,5394,2727,1838,1174,78,194,7,14,224,48,10,20.8333,"Here are some of the best data science project ideas on healthcare. If you want to become a data science professional in the healthcare domain then you must try to work on these projects.",#healthcare #health #covid #data #datascience #dataanalysis #dataanalytics #datascientist #machinelearning #python #pythonprogramming #pythonprojects #pythoncode #artificialintelligence #ai #dataanalyst #amankharwal #thecleverprogrammer
PID0003,Video,2021-12-12,4021,2085,1188,0,533,41,11,1,131,62,12,19.3548,"Learn how to train a machine learning model and giving inputs to your trained model to make predictions using Python.",#data #datascience #dataanalysis #dataanalytics #datascientist #machinelearning #python #pythonprogramming #pythonprojects #pythoncode #artificialintelligence #ai #deeplearning #machinelearningprojects #datascienceprojects #amankharwal #thecleverprogrammer #machinelearningmodels
PID0004,Image,2021-12-13,4528,2700,621,932,73,172,10,7,213,23,8,34.7826,"Here’s how you can write a Python program to detect whether a sentence is a question or not. The idea here is to find the words that we see in the beginning of a question in the beginning of a sentence.",#python #pythonprogramming #pythonprojects #pythoncode #pythonlearning #pythondeveloper #pythoncoding #pythonprogrammer #amankharwal #thecleverprogrammer #pythonprojects
PID0005,Reel,2021-12-14,2518,1704,255,279,37,96,5,4,123,8,0,0,"Plotting annotations while visualizing your data is considered good practice to make the graphs self-explanatory. Here is an example of how you can annotate a graph using Python.",#datavisualization #datascience #data #dataanalytics #machinelearning #dataanalysis #artificialintelligence #python #datascientist #bigdata #deeplearning #dataviz #ai #analytics #technology #dataanalyst #programming #pythonprogramming #statistics #coding #businessintelligence #datamining #tech #business #computerscience #tableau #database #thecleverprogrammer #amankharwal
